{"accords":["aromatic","green","woody","fresh spicy","balsamic","floral","earthy","herbal","sweet","citrus"],"brand":"Ralph Lauren","description":null,"edition":null,"evidence":{"accords":{"note":"Fragella provider assessment; may include model estimates. Individual observed/predicted provenance is unavailable. Provider confidence: high. Identity matched by exact name, reviewed brand aliases and inherited note corroboration; exact-identity-v1.","retrievedAt":"2026-10-24T03:32:38.250873+00:00","source":"https://api.fragella.com/api/v1/fragrances/safari-ralph-lauren-for-women","status":"provider"},"description":{"note":"Awaiting project-owned profile hydration","retrievedAt":null,"source":null,"status":"missing"},"gender":{"note":null,"retrievedAt":null,"source":"https://www.fragrantica.com/perfume/Ralph-Lauren/Safari-897.html","status":"inherited"},"identity":{"note":null,"retrievedAt":null,"source":"https://www.fragrantica.com/perfume/Ralph-Lauren/Safari-897.html","status":"inherited"},"longevity":{"note":"Fragella provider assessment; may include model estimates. Individual observed/predicted provenance is unavailable. Provider confidence: high. Identity matched by exact name, reviewed brand aliases and inherited note corroboration; exact-identity-v1.","retrievedAt":"2026-10-24T03:32:38.250873+00:00","source":"https://api.fragella.com/api/v1/fragrances/safari-ralph-lauren-for-women","status":"provider"},"mainNotes":{"note":"Exact ordered Social Card evidence imported from MarvvRed","retrievedAt":null,"source":"https://www.fragrantica.com/perfume/Ralph-Lauren/Safari-897.html","status":"inherited"},"pyramid":{"note":"Fragella provider assessment; may include model estimates. Individual observed/predicted provenance is unavailable. Provider confidence: high. Identity matched by exact name, reviewed brand aliases and inherited note corroboration; exact-identity-v1.","retrievedAt":"2026-10-24T03:32:38.250873+00:00","source":"https://api.fragella.com/api/v1/fragrances/safari-ralph-lauren-for-women","status":"provider"},"rating":{"note":"Fragella provider assessment; may include model estimates. Individual observed/predicted provenance is unavailable. Provider confidence: high. Identity matched by exact name, reviewed brand aliases and inherited note corroboration; exact-identity-v1.","retrievedAt":"2026-10-24T03:32:38.250873+00:00","source":"https://api.fragella.com/api/v1/fragrances/safari-ralph-lauren-for-women","status":"provider"},"seasons":{"note":null,"retrievedAt":null,"source":"https://www.fragrantica.com/perfume/Ralph-Lauren/Safari-897.html","status":"inherited"},"sillage":{"note":"Fragella provider assessment; may include model estimates. Individual observed/predicted provenance is unavailable. Provider confidence: high. Identity matched by exact name, reviewed brand aliases and inherited note corroboration; exact-identity-v1.","retrievedAt":"2026-10-24T03:32:38.250873+00:00","source":"https://api.fragella.com/api/v1/fragrances/safari-ralph-lauren-for-women","status":"provider"}},"fragranticaId":"897","fragranticaUrl":"https://www.fragrantica.com/perfume/Ralph-Lauren/Safari-897.html","gender":"feminine","id":"shobi-327","image":"assets/perfumes/897.avif","imageEvidence":{"note":"Imported local bottle asset","retrievedAt":null,"source":"https://www.fragrantica.com/perfume/Ralph-Lauren/Safari-897.html","status":"inherited"},"listings":[{"addedDate":null,"aliases":["2533-RAL"],"bestSellerRank":1244,"code":"1250-RAL","id":"327","originalId":"shobi-327","status":"active","url":"https://leparfum.com.gr/en/fragrances-for-men/1250-ral-m#/1-choose-eau_de_parfum/2-bottle-30ml/3-extra_essence-0ml"}],"longevity":{"label":"Long Lasting","scale":"Fragella descriptive assessment","votes":null},"mainNotes":[{"icon":"assets/note-icons/galbanum-45.webp","name":"Galbanum"},{"icon":"assets/note-icons/marigold-153.webp","name":"Marigold"},{"icon":"assets/note-icons/narcissus-18.webp","name":"Narcissus"},{"icon":"assets/note-icons/hyacinth-22.webp","name":"Hyacinth"},{"icon":"assets/note-icons/vetiver-2.webp","name":"Vetiver"},{"icon":"assets/note-icons/amber-54.webp","name":"Amber"}],"name":"Safari","nameAliases":["Safari for women"],"pyramid":{"base":["Vetiver","Amber","Sandalwood","Cedar","Patchouli"],"heart":["Narcissus","Orris Root","Rosemary","Rose","Italian Jasmine","Orange Blossom"],"top":["Galbanum","Marigold","Narcissus","Hiacynth","Orange","Black Currant","Mandarin Orange","Cassis"]},"rating":{"scale":"0–5 (Fragella Bayesian)","value":4.15,"votes":null},"schemaVersion":1,"seasons":["autumn"],"sillage":{"label":"Strong","scale":"Fragella descriptive assessment","votes":null},"validationChecks":{"fid":true,"gender":true,"icons":true,"identity":true,"image":true,"notes":true,"season":true,"shobiIdentity":true,"shobiProduct":true,"socialCard":true,"url":true},"validationIssues":[],"validationStatus":"green"}
