{"accords":["white floral","tuberose","woody","yellow floral","citrus","sweet","floral"],"brand":"Dior","description":"An oriental floral fragrance for women. Introduced in 2020.","edition":null,"evidence":{"accords":{"note":"Observed in a publicly accessible indexed original profile; exact source ID and perfume/house heading matched. public-page-extract-v1. Main Notes remain separate.","retrievedAt":"2026-10-24T03:58:28.904Z","source":"https://www.fragrantica.com/perfume/Dior/J-Adore-Infinissime-62638.html","status":"verified"},"description":{"note":"Observed in a publicly accessible indexed original profile; exact source ID and perfume/house heading matched. public-page-extract-v2. Main Notes remain separate.","retrievedAt":"2026-10-24T04:34:11.194Z","source":"https://www.fragrantica.com/perfume/Dior/J-Adore-Infinissime-62638.html","status":"verified"},"gender":{"note":null,"retrievedAt":null,"source":"https://www.fragrantica.com/perfume/Dior/J-Adore-Infinissime-62638.html","status":"inherited"},"identity":{"note":null,"retrievedAt":null,"source":"https://www.fragrantica.com/perfume/Dior/J-Adore-Infinissime-62638.html","status":"inherited"},"longevity":{"note":"Awaiting project-owned profile hydration","retrievedAt":null,"source":null,"status":"missing"},"mainNotes":{"note":"Exact ordered Social Card evidence imported from MarvvRed","retrievedAt":null,"source":"https://www.fragrantica.com/perfume/Dior/J-Adore-Infinissime-62638.html","status":"inherited"},"pyramid":{"note":"Observed in a publicly accessible indexed original profile; exact source ID and perfume/house heading matched. public-page-extract-v2. Main Notes remain separate.","retrievedAt":"2026-10-24T04:34:11.194Z","source":"https://www.fragrantica.com/perfume/Dior/J-Adore-Infinissime-62638.html","status":"verified"},"rating":{"note":"Observed in a publicly accessible indexed original profile; exact source ID and perfume/house heading matched. public-page-extract-v2. Main Notes remain separate.","retrievedAt":"2026-10-24T04:34:11.194Z","source":"https://www.fragrantica.com/perfume/Dior/J-Adore-Infinissime-62638.html","status":"verified"},"seasons":{"note":null,"retrievedAt":null,"source":"https://www.fragrantica.com/perfume/Dior/J-Adore-Infinissime-62638.html","status":"inherited"},"sillage":{"note":"Awaiting project-owned profile hydration","retrievedAt":null,"source":null,"status":"missing"}},"fragranticaId":"62638","fragranticaUrl":"https://www.fragrantica.com/perfume/Dior/J-Adore-Infinissime-62638.html","gender":"feminine","id":"shobi-2676","image":"assets/perfumes/62638.avif","imageEvidence":{"note":"Imported local bottle asset","retrievedAt":null,"source":"https://www.fragrantica.com/perfume/Dior/J-Adore-Infinissime-62638.html","status":"inherited"},"listings":[{"addedDate":null,"aliases":[],"bestSellerRank":1106,"code":"1803-DRC","id":"2676","originalId":"shobi-2676","status":"active","url":"https://leparfum.com.gr/en/fragrances-for-women/1803-drc-w"}],"longevity":null,"mainNotes":[{"icon":"assets/note-icons/tuberose-25.webp","name":"Tuberose"},{"icon":"assets/note-icons/jasmine-14.webp","name":"Jasmine"},{"icon":"assets/note-icons/ylang-ylang-24.webp","name":"Ylang-Ylang"},{"icon":"assets/note-icons/sandalwood-33.webp","name":"Sandalwood"},{"icon":"assets/note-icons/blood-orange-286.webp","name":"Blood Orange"},{"icon":"assets/note-icons/lily-of-the-valley-109.webp","name":"Lily-of-the-Valley"}],"name":"J'Adore Infinissime","nameAliases":["J Adore Infinissime"],"pyramid":{"base":["Sandalwood"],"heart":["Tuberose","Jasmine Sambac","Ylang-Ylang","Lily-of-the-Valley","Rose"],"top":["Blood Orange","Pink Pepper","Bergamot"]},"rating":{"scale":"0–5","value":3.83,"votes":2351},"schemaVersion":1,"seasons":["autumn"],"sillage":null,"validationChecks":{"fid":true,"gender":true,"icons":true,"identity":true,"image":true,"notes":true,"season":true,"shobiIdentity":true,"shobiProduct":true,"socialCard":true,"url":true},"validationIssues":[],"validationStatus":"green"}
