{"accords":["honey","oud","warm spicy","cinnamon","sweet","amber","floral","vanilla","animalic","leather"],"brand":"Montale","description":"An oriental vanilla fragrance for women and men. Introduced in 2015.","edition":null,"evidence":{"accords":{"note":"Observed in a publicly accessible indexed original profile; exact source ID and perfume/house heading matched. public-page-extract-v1. Main Notes remain separate.","retrievedAt":"2026-10-24T03:58:27.248Z","source":"https://www.fragrantica.com/perfume/Montale/Honey-Aoud-30509.html","status":"verified"},"description":{"note":"Observed in a publicly accessible indexed original profile; exact source ID and perfume/house heading matched. public-page-extract-v1. Main Notes remain separate.","retrievedAt":"2026-10-24T03:58:27.248Z","source":"https://www.fragrantica.com/perfume/Montale/Honey-Aoud-30509.html","status":"verified"},"gender":{"note":null,"retrievedAt":null,"source":"https://www.fragrantica.com/perfume/Montale/Honey-Aoud-30509.html","status":"inherited"},"identity":{"note":null,"retrievedAt":null,"source":"https://www.fragrantica.com/perfume/Montale/Honey-Aoud-30509.html","status":"inherited"},"longevity":{"note":"Awaiting project-owned profile hydration","retrievedAt":null,"source":null,"status":"missing"},"mainNotes":{"note":"Exact ordered Social Card evidence imported from MarvvRed","retrievedAt":null,"source":"https://www.fragrantica.com/perfume/Montale/Honey-Aoud-30509.html","status":"inherited"},"pyramid":{"note":"Awaiting project-owned profile hydration","retrievedAt":null,"source":null,"status":"missing"},"rating":{"note":"Observed in a publicly accessible indexed original profile; exact source ID and perfume/house heading matched. public-page-extract-v1. Main Notes remain separate.","retrievedAt":"2026-10-24T03:58:27.248Z","source":"https://www.fragrantica.com/perfume/Montale/Honey-Aoud-30509.html","status":"verified"},"seasons":{"note":null,"retrievedAt":null,"source":"https://www.fragrantica.com/perfume/Montale/Honey-Aoud-30509.html","status":"inherited"},"sillage":{"note":"Awaiting project-owned profile hydration","retrievedAt":null,"source":null,"status":"missing"}},"fragranticaId":"30509","fragranticaUrl":"https://www.fragrantica.com/perfume/Montale/Honey-Aoud-30509.html","gender":"unisex","id":"shobi-3207","image":"assets/perfumes/30509.avif","imageEvidence":{"note":"Imported local bottle asset","retrievedAt":null,"source":"https://www.fragrantica.com/perfume/Montale/Honey-Aoud-30509.html","status":"inherited"},"listings":[{"addedDate":null,"aliases":[],"bestSellerRank":687,"code":"2009-MNT","id":"3207","originalId":"shobi-3207","status":"active","url":"https://leparfum.com.gr/en/elegants-fragrances/2009-mnt-el-perfume#/1-choose-eau_de_parfum/2-bottle-30ml/3-extra_essence-0ml"}],"longevity":null,"mainNotes":[{"icon":"assets/note-icons/honey-181.webp","name":"Honey"},{"icon":"assets/note-icons/agarwood-oud-114.webp","name":"Agarwood (Oud)"},{"icon":"assets/note-icons/cinnamon-65.webp","name":"Cinnamon"},{"icon":"assets/note-icons/amber-54.webp","name":"Amber"},{"icon":"assets/note-icons/vanilla-74.webp","name":"Vanilla"},{"icon":"assets/note-icons/leather-156.webp","name":"Leather"}],"name":"Honey Aoud","nameAliases":[],"pyramid":{"base":[],"heart":[],"top":[]},"rating":{"scale":"0–5","value":4.13,"votes":3375},"schemaVersion":1,"seasons":["winter"],"sillage":null,"validationChecks":{"fid":true,"gender":true,"icons":true,"identity":true,"image":true,"notes":true,"season":true,"shobiIdentity":true,"shobiProduct":true,"socialCard":true,"url":true},"validationIssues":[],"validationStatus":"green"}
