{"accords":["aromatic","amber","fruity","herbal","woody","soft spicy","fresh","green","musky"],"brand":"Yves Saint Laurent","description":null,"edition":null,"evidence":{"accords":{"note":"Fragella provider assessment; may include model estimates. Individual observed/predicted provenance is unavailable. Provider confidence: high. Identity matched by exact name, reviewed brand aliases and inherited note corroboration; exact-identity-v1.","retrievedAt":"2026-10-24T03:18:27.263289+00:00","source":"https://api.fragella.com/api/v1/fragrances/yves-saint-laurent-kouros-silver-yves-saint-laurent-for-men","status":"provider"},"description":{"note":"Awaiting project-owned profile hydration","retrievedAt":null,"source":null,"status":"missing"},"gender":{"note":null,"retrievedAt":null,"source":"https://www.fragrantica.com/perfume/Yves-Saint-Laurent/Yves-Saint-Laurent-Kouros-Silver-30240.html","status":"inherited"},"identity":{"note":null,"retrievedAt":null,"source":"https://www.fragrantica.com/perfume/Yves-Saint-Laurent/Yves-Saint-Laurent-Kouros-Silver-30240.html","status":"inherited"},"longevity":{"note":"Fragella provider assessment; may include model estimates. Individual observed/predicted provenance is unavailable. Provider confidence: high. Identity matched by exact name, reviewed brand aliases and inherited note corroboration; exact-identity-v1.","retrievedAt":"2026-10-24T03:18:27.263289+00:00","source":"https://api.fragella.com/api/v1/fragrances/yves-saint-laurent-kouros-silver-yves-saint-laurent-for-men","status":"provider"},"mainNotes":{"note":"Exact ordered Social Card evidence imported from MarvvRed","retrievedAt":null,"source":"https://www.fragrantica.com/perfume/Yves-Saint-Laurent/Yves-Saint-Laurent-Kouros-Silver-30240.html","status":"inherited"},"pyramid":{"note":"Fragella provider assessment; may include model estimates. Individual observed/predicted provenance is unavailable. Provider confidence: high. Identity matched by exact name, reviewed brand aliases and inherited note corroboration; exact-identity-v1.","retrievedAt":"2026-10-24T03:18:27.263289+00:00","source":"https://api.fragella.com/api/v1/fragrances/yves-saint-laurent-kouros-silver-yves-saint-laurent-for-men","status":"provider"},"rating":{"note":"Fragella provider assessment; may include model estimates. Individual observed/predicted provenance is unavailable. Provider confidence: high. Identity matched by exact name, reviewed brand aliases and inherited note corroboration; exact-identity-v1.","retrievedAt":"2026-10-24T03:18:27.263289+00:00","source":"https://api.fragella.com/api/v1/fragrances/yves-saint-laurent-kouros-silver-yves-saint-laurent-for-men","status":"provider"},"seasons":{"note":null,"retrievedAt":null,"source":"https://www.fragrantica.com/perfume/Yves-Saint-Laurent/Yves-Saint-Laurent-Kouros-Silver-30240.html","status":"inherited"},"sillage":{"note":"Fragella provider assessment; may include model estimates. Individual observed/predicted provenance is unavailable. Provider confidence: high. Identity matched by exact name, reviewed brand aliases and inherited note corroboration; exact-identity-v1.","retrievedAt":"2026-10-24T03:18:27.263289+00:00","source":"https://api.fragella.com/api/v1/fragrances/yves-saint-laurent-kouros-silver-yves-saint-laurent-for-men","status":"provider"}},"fragranticaId":"30240","fragranticaUrl":"https://www.fragrantica.com/perfume/Yves-Saint-Laurent/Yves-Saint-Laurent-Kouros-Silver-30240.html","gender":"masculine","id":"shobi-355","image":"assets/perfumes/30240.avif","imageEvidence":{"note":"Imported local bottle asset","retrievedAt":null,"source":"https://www.fragrantica.com/perfume/Yves-Saint-Laurent/Yves-Saint-Laurent-Kouros-Silver-30240.html","status":"inherited"},"listings":[{"addedDate":null,"aliases":[],"bestSellerRank":1930,"code":"1279-YZLO","id":"355","originalId":"shobi-355","status":"active","url":"https://leparfum.com.gr/en/fragrances-for-men/1279-yzlo-m#/1-choose-eau_de_parfum/2-bottle-30ml/3-extra_essence-0ml"}],"longevity":{"label":"Long Lasting","scale":"Fragella descriptive assessment","votes":null},"mainNotes":[{"icon":"assets/note-icons/sage-52.webp","name":"Sage"},{"icon":"assets/note-icons/apple-146.webp","name":"Apple"},{"icon":"assets/note-icons/amber-54.webp","name":"Amber"},{"icon":"assets/note-icons/woody-notes-315.webp","name":"Woody Notes"}],"name":"Yves Saint Laurent Kouros Silver","nameAliases":["Yves Saint Laurent Kouros Silver for men"],"pyramid":{"base":["Amber","Woody Notes"],"heart":["Sage"],"top":["Apple"]},"rating":{"scale":"0–5 (Fragella Bayesian)","value":3.81,"votes":null},"schemaVersion":1,"seasons":["spring"],"sillage":{"label":"Strong","scale":"Fragella descriptive assessment","votes":null},"validationChecks":{"fid":true,"gender":true,"icons":true,"identity":true,"image":true,"notes":true,"season":true,"shobiIdentity":true,"shobiProduct":true,"socialCard":true,"url":true},"validationIssues":[],"validationStatus":"green"}
