{"accords":["vanilla","woody","amber","powdery","sweet","fruity","balsamic","warm spicy","floral","yellow floral"],"brand":"Montale","description":null,"edition":null,"evidence":{"accords":{"note":"Observed in a publicly accessible indexed original profile; exact source ID and perfume/house heading matched. public-page-extract-v1. Main Notes remain separate.","retrievedAt":"2026-10-24T03:58:31.859Z","source":"https://www.fragrantica.com/perfume/Montale/Vanilla-Extasy-4059.html","status":"verified"},"description":{"note":"Awaiting project-owned profile hydration","retrievedAt":null,"source":null,"status":"missing"},"gender":{"note":null,"retrievedAt":null,"source":"https://www.fragrantica.com/perfume/Montale/Vanilla-Extasy-4059.html","status":"inherited"},"identity":{"note":null,"retrievedAt":null,"source":"https://www.fragrantica.com/perfume/Montale/Vanilla-Extasy-4059.html","status":"inherited"},"longevity":{"note":"Awaiting project-owned profile hydration","retrievedAt":null,"source":null,"status":"missing"},"mainNotes":{"note":"Exact ordered Social Card evidence imported from MarvvRed","retrievedAt":null,"source":"https://www.fragrantica.com/perfume/Montale/Vanilla-Extasy-4059.html","status":"inherited"},"pyramid":{"note":"Awaiting project-owned profile hydration","retrievedAt":null,"source":null,"status":"missing"},"rating":{"note":"Observed in a publicly accessible indexed original profile; exact source ID and perfume/house heading matched. public-page-extract-v1. Main Notes remain separate.","retrievedAt":"2026-10-24T03:58:31.859Z","source":"https://www.fragrantica.com/perfume/Montale/Vanilla-Extasy-4059.html","status":"verified"},"seasons":{"note":null,"retrievedAt":null,"source":"https://www.fragrantica.com/perfume/Montale/Vanilla-Extasy-4059.html","status":"inherited"},"sillage":{"note":"Awaiting project-owned profile hydration","retrievedAt":null,"source":null,"status":"missing"}},"fragranticaId":"4059","fragranticaUrl":"https://www.fragrantica.com/perfume/Montale/Vanilla-Extasy-4059.html","gender":"feminine","id":"shobi-2333","image":"assets/perfumes/4059.avif","imageEvidence":{"note":"Imported local bottle asset","retrievedAt":null,"source":"https://www.fragrantica.com/perfume/Montale/Vanilla-Extasy-4059.html","status":"inherited"},"listings":[{"addedDate":null,"aliases":[],"bestSellerRank":1203,"code":"1617-MNT","id":"2333","originalId":"shobi-2333","status":"active","url":"https://leparfum.com.gr/en/niche-perfumes/1617-mnt-n#/1-choose-eau_de_parfum/2-bottle-30ml/3-extra_essence-0ml"}],"longevity":null,"mainNotes":[{"icon":"assets/note-icons/vanilla-74.webp","name":"Vanilla"},{"icon":"assets/note-icons/apricot-175.webp","name":"Apricot"},{"icon":"assets/note-icons/benzoin-69.webp","name":"Benzoin"},{"icon":"assets/note-icons/sandalwood-33.webp","name":"Sandalwood"},{"icon":"assets/note-icons/resins-317.webp","name":"Resins"},{"icon":"assets/note-icons/ylang-ylang-24.webp","name":"Ylang-Ylang"}],"name":"Vanilla Extasy","nameAliases":[],"pyramid":{"base":[],"heart":[],"top":[]},"rating":{"scale":"0–5","value":3.76,"votes":1900},"schemaVersion":1,"seasons":["autumn"],"sillage":null,"validationChecks":{"fid":true,"gender":true,"icons":true,"identity":true,"image":true,"notes":true,"season":true,"shobiIdentity":true,"shobiProduct":true,"socialCard":true,"url":true},"validationIssues":[],"validationStatus":"green"}
