{"accords":["citrus","green","aromatic","woody","fresh spicy","musky","conifer"],"brand":"Maison Martin Margiela","description":null,"edition":null,"evidence":{"accords":{"note":"Observed in a publicly accessible indexed original profile; exact source ID and perfume/house heading matched. public-page-extract-v1. Main Notes remain separate.","retrievedAt":"2026-10-24T03:58:23.055Z","source":"https://www.fragrantica.com/perfume/Maison-Martin-Margiela/Under-The-Lemon-Tree-53379.html","status":"verified"},"description":{"note":"Awaiting project-owned profile hydration","retrievedAt":null,"source":null,"status":"missing"},"gender":{"note":null,"retrievedAt":null,"source":"https://www.fragrantica.com/perfume/Maison-Martin-Margiela/Under-The-Lemon-Tree-53379.html","status":"inherited"},"identity":{"note":null,"retrievedAt":null,"source":"https://www.fragrantica.com/perfume/Maison-Martin-Margiela/Under-The-Lemon-Tree-53379.html","status":"inherited"},"longevity":{"note":"Awaiting project-owned profile hydration","retrievedAt":null,"source":null,"status":"missing"},"mainNotes":{"note":"Exact ordered Social Card evidence imported from MarvvRed","retrievedAt":null,"source":"https://www.fragrantica.com/perfume/Maison-Martin-Margiela/Under-The-Lemon-Tree-53379.html","status":"inherited"},"pyramid":{"note":"Observed in a publicly accessible indexed original profile; exact source ID and perfume/house heading matched. public-page-extract-v2. Main Notes remain separate.","retrievedAt":"2026-10-24T04:36:04.929Z","source":"https://www.fragrantica.com/perfume/Maison-Martin-Margiela/Under-The-Lemon-Tree-53379.html","status":"verified"},"rating":{"note":"Observed in a publicly accessible indexed original profile; exact source ID and perfume/house heading matched. public-page-extract-v1. Main Notes remain separate.","retrievedAt":"2026-10-24T03:58:23.055Z","source":"https://www.fragrantica.com/perfume/Maison-Martin-Margiela/Under-The-Lemon-Tree-53379.html","status":"verified"},"seasons":{"note":null,"retrievedAt":null,"source":"https://www.fragrantica.com/perfume/Maison-Martin-Margiela/Under-The-Lemon-Tree-53379.html","status":"inherited"},"sillage":{"note":"Awaiting project-owned profile hydration","retrievedAt":null,"source":null,"status":"missing"}},"fragranticaId":"53379","fragranticaUrl":"https://www.fragrantica.com/perfume/Maison-Martin-Margiela/Under-The-Lemon-Tree-53379.html","gender":"unisex","id":"shobi-3796","image":"assets/perfumes/53379.avif","imageEvidence":{"note":"Imported local bottle asset","retrievedAt":null,"source":"https://www.fragrantica.com/perfume/Maison-Martin-Margiela/Under-The-Lemon-Tree-53379.html","status":"inherited"},"listings":[{"addedDate":null,"aliases":[],"bestSellerRank":310,"code":"2168-MARG","id":"3796","originalId":"shobi-3796","status":"active","url":"https://leparfum.com.gr/en/elegants-fragrances/2168-marg-el"}],"longevity":null,"mainNotes":[{"icon":"assets/note-icons/lime-78.webp","name":"Lime"},{"icon":"assets/note-icons/tea-106.webp","name":"Tea"},{"icon":"assets/note-icons/petitgrain-3.webp","name":"Petitgrain"},{"icon":"assets/note-icons/musk-4.webp","name":"Musk"},{"icon":"assets/note-icons/mate-48.webp","name":"Mate"},{"icon":"assets/note-icons/cedar-41.webp","name":"Cedar"}],"name":"Under The Lemon Tree","nameAliases":[],"pyramid":{"base":["White Musk","Cedar","Rock rose"],"heart":["Green Tea","Mate","Coriander"],"top":["Lime","Petitgrain","Cardamom"]},"rating":{"scale":"0–5","value":3.83,"votes":4671},"schemaVersion":1,"seasons":["summer"],"sillage":null,"validationChecks":{"fid":true,"gender":true,"icons":true,"identity":true,"image":true,"notes":true,"season":true,"shobiIdentity":true,"shobiProduct":true,"socialCard":true,"url":true},"validationIssues":[],"validationStatus":"green"}
