{"accords":["fresh spicy","woody","rose","oud","aromatic","warm spicy","conifer"],"brand":"Swiss Arabian","description":null,"edition":null,"evidence":{"accords":{"note":"Fragella provider assessment; may include model estimates. Individual observed/predicted provenance is unavailable. Provider confidence: low. Identity matched by exact name, reviewed brand aliases and inherited note corroboration; exact-identity-v1.","retrievedAt":"2026-10-24T03:17:12.131328+00:00","source":"https://api.fragella.com/api/v1/fragrances/habeitak-swiss-arabian-for-women","status":"provider"},"description":{"note":"Awaiting project-owned profile hydration","retrievedAt":null,"source":null,"status":"missing"},"gender":{"note":null,"retrievedAt":null,"source":"https://www.fragrantica.com/perfume/Swiss-Arabian/Habeitak-10845.html","status":"inherited"},"identity":{"note":null,"retrievedAt":null,"source":"https://www.fragrantica.com/perfume/Swiss-Arabian/Habeitak-10845.html","status":"inherited"},"longevity":{"note":"Fragella provider assessment; may include model estimates. Individual observed/predicted provenance is unavailable. Provider confidence: low. Identity matched by exact name, reviewed brand aliases and inherited note corroboration; exact-identity-v1.","retrievedAt":"2026-10-24T03:17:12.131328+00:00","source":"https://api.fragella.com/api/v1/fragrances/habeitak-swiss-arabian-for-women","status":"provider"},"mainNotes":{"note":"Exact ordered Social Card evidence imported from MarvvRed","retrievedAt":null,"source":"https://www.fragrantica.com/perfume/Swiss-Arabian/Habeitak-10845.html","status":"inherited"},"pyramid":{"note":"Fragella provider assessment; may include model estimates. Individual observed/predicted provenance is unavailable. Provider confidence: low. Identity matched by exact name, reviewed brand aliases and inherited note corroboration; exact-identity-v1.","retrievedAt":"2026-10-24T03:17:12.131328+00:00","source":"https://api.fragella.com/api/v1/fragrances/habeitak-swiss-arabian-for-women","status":"provider"},"rating":{"note":"Fragella provider assessment; may include model estimates. Individual observed/predicted provenance is unavailable. Provider confidence: low. Identity matched by exact name, reviewed brand aliases and inherited note corroboration; exact-identity-v1.","retrievedAt":"2026-10-24T03:17:12.131328+00:00","source":"https://api.fragella.com/api/v1/fragrances/habeitak-swiss-arabian-for-women","status":"provider"},"seasons":{"note":null,"retrievedAt":null,"source":"https://www.fragrantica.com/perfume/Swiss-Arabian/Habeitak-10845.html","status":"inherited"},"sillage":{"note":"Fragella provider assessment; may include model estimates. Individual observed/predicted provenance is unavailable. Provider confidence: low. Identity matched by exact name, reviewed brand aliases and inherited note corroboration; exact-identity-v1.","retrievedAt":"2026-10-24T03:17:12.131328+00:00","source":"https://api.fragella.com/api/v1/fragrances/habeitak-swiss-arabian-for-women","status":"provider"}},"fragranticaId":"10845","fragranticaUrl":"https://www.fragrantica.com/perfume/Swiss-Arabian/Habeitak-10845.html","gender":"feminine","id":"shobi-3199","image":"assets/perfumes/10845.avif","imageEvidence":{"note":"Imported local bottle asset","retrievedAt":null,"source":"https://www.fragrantica.com/perfume/Swiss-Arabian/Habeitak-10845.html","status":"inherited"},"listings":[{"addedDate":null,"aliases":[],"bestSellerRank":2214,"code":"2007-SWISA","id":"3199","originalId":"shobi-3199","status":"active","url":"https://leparfum.com.gr/en/arabian-perfumes/habeitak-swiss-arabian-clone"}],"longevity":{"label":"Moderate","scale":"Fragella descriptive assessment","votes":null},"mainNotes":[{"icon":"assets/note-icons/rose-105.webp","name":"Rose"},{"icon":"assets/note-icons/pepper-158.webp","name":"Pepper"},{"icon":"assets/note-icons/agarwood-oud-114.webp","name":"Agarwood (Oud)"},{"icon":"assets/note-icons/pine-tree-204.webp","name":"Pine Tree"},{"icon":"assets/note-icons/cedar-41.webp","name":"Cedar"},{"icon":"assets/note-icons/cumin-549.webp","name":"Cumin"}],"name":"Habeitak","nameAliases":["Habeitak for women"],"pyramid":{"base":["Agarwood (Oud)","Cedar","Patchouli","Musk"],"heart":["Pepper","Cumin","Orris Root","Hyacinth"],"top":["Rose","Pine Tree"]},"rating":{"scale":"0–5 (Fragella Bayesian)","value":3.98,"votes":null},"schemaVersion":1,"seasons":["spring"],"sillage":{"label":"Strong","scale":"Fragella descriptive assessment","votes":null},"validationChecks":{"fid":true,"gender":true,"icons":true,"identity":true,"image":true,"notes":true,"season":true,"shobiIdentity":true,"shobiProduct":true,"socialCard":true,"url":true},"validationIssues":[],"validationStatus":"green"}
