{"accords":["amber","almond","warm spicy","woody","musky","animalic","nutty","fruity","metallic","white floral","gourmand"],"brand":"Maison Francis Kurkdjian","description":null,"edition":null,"evidence":{"accords":{"note":"Fragella provider assessment; may include model estimates. Individual observed/predicted provenance is unavailable. Provider confidence: high. Identity matched by exact name, reviewed brand aliases and inherited note corroboration; exact-identity-v1.","retrievedAt":"2026-10-24T03:13:25.025554+00:00","source":"https://api.fragella.com/api/v1/fragrances/baccarat-rouge-540-extrait-de-parfum-maison-francis-kurkdjian-unisex","status":"provider"},"description":{"note":"Awaiting project-owned profile hydration","retrievedAt":null,"source":null,"status":"missing"},"gender":{"note":null,"retrievedAt":null,"source":"https://www.fragrantica.com/p/46066","status":"inherited"},"identity":{"note":null,"retrievedAt":null,"source":"https://www.fragrantica.com/p/46066","status":"inherited"},"longevity":{"note":"Fragella provider assessment; may include model estimates. Individual observed/predicted provenance is unavailable. Provider confidence: high. Identity matched by exact name, reviewed brand aliases and inherited note corroboration; exact-identity-v1.","retrievedAt":"2026-10-24T03:13:25.025554+00:00","source":"https://api.fragella.com/api/v1/fragrances/baccarat-rouge-540-extrait-de-parfum-maison-francis-kurkdjian-unisex","status":"provider"},"mainNotes":{"note":"Exact ordered Social Card evidence imported from MarvvRed","retrievedAt":null,"source":"https://www.fragrantica.com/p/46066","status":"inherited"},"pyramid":{"note":"Fragella provider assessment; may include model estimates. Individual observed/predicted provenance is unavailable. Provider confidence: high. Identity matched by exact name, reviewed brand aliases and inherited note corroboration; exact-identity-v1.","retrievedAt":"2026-10-24T03:13:25.025554+00:00","source":"https://api.fragella.com/api/v1/fragrances/baccarat-rouge-540-extrait-de-parfum-maison-francis-kurkdjian-unisex","status":"provider"},"rating":{"note":"Fragella provider assessment; may include model estimates. Individual observed/predicted provenance is unavailable. Provider confidence: high. Identity matched by exact name, reviewed brand aliases and inherited note corroboration; exact-identity-v1.","retrievedAt":"2026-10-24T03:13:25.025554+00:00","source":"https://api.fragella.com/api/v1/fragrances/baccarat-rouge-540-extrait-de-parfum-maison-francis-kurkdjian-unisex","status":"provider"},"seasons":{"note":null,"retrievedAt":null,"source":"https://www.fragrantica.com/p/46066","status":"inherited"},"sillage":{"note":"Fragella provider assessment; may include model estimates. Individual observed/predicted provenance is unavailable. Provider confidence: high. Identity matched by exact name, reviewed brand aliases and inherited note corroboration; exact-identity-v1.","retrievedAt":"2026-10-24T03:13:25.025554+00:00","source":"https://api.fragella.com/api/v1/fragrances/baccarat-rouge-540-extrait-de-parfum-maison-francis-kurkdjian-unisex","status":"provider"}},"fragranticaId":"46066","fragranticaUrl":"https://www.fragrantica.com/p/46066","gender":"unisex","id":"shobi-2269","image":"assets/perfumes/46066.avif","imageEvidence":{"note":"Imported local bottle asset","retrievedAt":null,"source":"https://www.fragrantica.com/p/46066","status":"inherited"},"listings":[{"addedDate":null,"aliases":[],"bestSellerRank":91,"code":"1528-KUR","id":"2269","originalId":"shobi-2269","status":"active","url":"https://leparfum.com.gr/en/niche-perfumes/1528-kur-n#/1-choose-eau_de_parfum/2-bottle-30ml/3-extra_essence-0ml"}],"longevity":{"label":"Long Lasting","scale":"Fragella descriptive assessment","votes":null},"mainNotes":[{"icon":"assets/note-icons/almond-130.webp","name":"Almond"},{"icon":"assets/note-icons/saffron-55.webp","name":"Saffron"},{"icon":"assets/note-icons/ambergris-524.webp","name":"Ambergris"},{"icon":"assets/note-icons/woody-notes-315.webp","name":"Woody Notes"},{"icon":"assets/note-icons/musk-4.webp","name":"Musk"},{"icon":"assets/note-icons/jasmine-14.webp","name":"Jasmine"}],"name":"Baccarat Rouge 540 Extrait de Parfum","nameAliases":["Baccarat Rouge 540 Extrait de Parfum unisex"],"pyramid":{"base":["Ambergris","Woody Notes","Musk","Ambroxan","Cashmeran"],"heart":["Egyptian Jasmine","Virginia Cedar"],"top":["Bitter Almond","Saffron"]},"rating":{"scale":"0–5 (Fragella Bayesian)","value":4.12,"votes":null},"schemaVersion":1,"seasons":["autumn"],"sillage":{"label":"Strong","scale":"Fragella descriptive assessment","votes":null},"validationChecks":{"fid":true,"gender":true,"icons":true,"identity":true,"image":true,"notes":true,"season":true,"shobiIdentity":true,"shobiProduct":true,"socialCard":true,"url":true},"validationIssues":[],"validationStatus":"green"}
