{"accords":["vanilla","ozonic","musky","aquatic","powdery","white floral","woody","sweet","fresh","fruity"],"brand":"Clinique","description":null,"edition":null,"evidence":{"accords":{"note":"Fragella provider assessment; may include model estimates. Individual observed/predicted provenance is unavailable. Provider confidence: low. Identity matched by exact name, reviewed brand aliases and inherited note corroboration; exact-identity-v1.","retrievedAt":"2026-10-24T03:26:09.928210+00:00","source":"https://api.fragella.com/api/v1/fragrances/simply-clinique-clinique-for-women","status":"provider"},"description":{"note":"Awaiting project-owned profile hydration","retrievedAt":null,"source":null,"status":"missing"},"gender":{"note":null,"retrievedAt":null,"source":"https://www.fragrantica.com/perfume/Clinique/Simply-Clinique-379.html","status":"inherited"},"identity":{"note":null,"retrievedAt":null,"source":"https://www.fragrantica.com/perfume/Clinique/Simply-Clinique-379.html","status":"inherited"},"longevity":{"note":"Fragella provider assessment; may include model estimates. Individual observed/predicted provenance is unavailable. Provider confidence: low. Identity matched by exact name, reviewed brand aliases and inherited note corroboration; exact-identity-v1.","retrievedAt":"2026-10-24T03:26:09.928210+00:00","source":"https://api.fragella.com/api/v1/fragrances/simply-clinique-clinique-for-women","status":"provider"},"mainNotes":{"note":"Exact ordered Social Card evidence imported from MarvvRed","retrievedAt":null,"source":"https://www.fragrantica.com/perfume/Clinique/Simply-Clinique-379.html","status":"inherited"},"pyramid":{"note":"Fragella provider assessment; may include model estimates. Individual observed/predicted provenance is unavailable. Provider confidence: low. Identity matched by exact name, reviewed brand aliases and inherited note corroboration; exact-identity-v1.","retrievedAt":"2026-10-24T03:26:09.928210+00:00","source":"https://api.fragella.com/api/v1/fragrances/simply-clinique-clinique-for-women","status":"provider"},"rating":{"note":"Fragella provider assessment; may include model estimates. Individual observed/predicted provenance is unavailable. Provider confidence: low. Identity matched by exact name, reviewed brand aliases and inherited note corroboration; exact-identity-v1.","retrievedAt":"2026-10-24T03:26:09.928210+00:00","source":"https://api.fragella.com/api/v1/fragrances/simply-clinique-clinique-for-women","status":"provider"},"seasons":{"note":null,"retrievedAt":null,"source":"https://www.fragrantica.com/perfume/Clinique/Simply-Clinique-379.html","status":"inherited"},"sillage":{"note":"Fragella provider assessment; may include model estimates. Individual observed/predicted provenance is unavailable. Provider confidence: low. Identity matched by exact name, reviewed brand aliases and inherited note corroboration; exact-identity-v1.","retrievedAt":"2026-10-24T03:26:09.928210+00:00","source":"https://api.fragella.com/api/v1/fragrances/simply-clinique-clinique-for-women","status":"provider"}},"fragranticaId":"379","fragranticaUrl":"https://www.fragrantica.com/perfume/Clinique/Simply-Clinique-379.html","gender":"feminine","id":"shobi-639","image":"assets/perfumes/379.avif","imageEvidence":{"note":"Imported local bottle asset","retrievedAt":null,"source":"https://www.fragrantica.com/perfume/Clinique/Simply-Clinique-379.html","status":"inherited"},"listings":[{"addedDate":null,"aliases":[],"bestSellerRank":348,"code":"549-CLI","id":"639","originalId":"shobi-639","status":"active","url":"https://leparfum.com.gr/en/fragrances-for-women/simply-fragrance-dupe"}],"longevity":{"label":"Long Lasting","scale":"Fragella descriptive assessment","votes":null},"mainNotes":[{"icon":"assets/note-icons/soybean-224.webp","name":"Soybean"},{"icon":"assets/note-icons/melon-172.webp","name":"Melon"},{"icon":"assets/note-icons/vanilla-74.webp","name":"Vanilla"},{"icon":"assets/note-icons/musk-4.webp","name":"Musk"},{"icon":"assets/note-icons/white-flowers-323.webp","name":"White Flowers"},{"icon":"assets/note-icons/woody-notes-315.webp","name":"Woody Notes"}],"name":"Simply Clinique","nameAliases":["Simply Clinique for women"],"pyramid":{"base":["Vanilla","White Musk","Woody Notes"],"heart":["Soybean"],"top":["Melon","White Flowers"]},"rating":{"scale":"0–5 (Fragella Bayesian)","value":3.82,"votes":null},"schemaVersion":1,"seasons":["spring"],"sillage":{"label":"Strong","scale":"Fragella descriptive assessment","votes":null},"validationChecks":{"fid":true,"gender":true,"icons":true,"identity":true,"image":true,"notes":true,"season":true,"shobiIdentity":true,"shobiProduct":true,"socialCard":true,"url":true},"validationIssues":[],"validationStatus":"green"}
