{"accords":["white floral","yellow floral","sweet","citrus","woody","musky","powdery"],"brand":"Dior","description":null,"edition":null,"evidence":{"accords":{"note":"Fragella provider assessment; may include model estimates. Individual observed/predicted provenance is unavailable. Provider confidence: medium. Identity matched by exact name, reviewed brand aliases and inherited note corroboration; exact-identity-v1.","retrievedAt":"2026-10-24T03:26:00.347307+00:00","source":"https://api.fragella.com/api/v1/fragrances/dior-grand-bal-dior-for-women","status":"provider"},"description":{"note":"Awaiting project-owned profile hydration","retrievedAt":null,"source":null,"status":"missing"},"gender":{"note":null,"retrievedAt":null,"source":"https://www.fragrantica.com/p/14984","status":"inherited"},"identity":{"note":null,"retrievedAt":null,"source":"https://www.fragrantica.com/p/14984","status":"inherited"},"longevity":{"note":"Fragella provider assessment; may include model estimates. Individual observed/predicted provenance is unavailable. Provider confidence: medium. Identity matched by exact name, reviewed brand aliases and inherited note corroboration; exact-identity-v1.","retrievedAt":"2026-10-24T03:26:00.347307+00:00","source":"https://api.fragella.com/api/v1/fragrances/dior-grand-bal-dior-for-women","status":"provider"},"mainNotes":{"note":"Exact ordered Social Card evidence imported from MarvvRed","retrievedAt":null,"source":"https://www.fragrantica.com/p/14984","status":"inherited"},"pyramid":{"note":"Fragella provider assessment; may include model estimates. Individual observed/predicted provenance is unavailable. Provider confidence: medium. Identity matched by exact name, reviewed brand aliases and inherited note corroboration; exact-identity-v1.","retrievedAt":"2026-10-24T03:26:00.347307+00:00","source":"https://api.fragella.com/api/v1/fragrances/dior-grand-bal-dior-for-women","status":"provider"},"rating":{"note":"Fragella provider assessment; may include model estimates. Individual observed/predicted provenance is unavailable. Provider confidence: medium. Identity matched by exact name, reviewed brand aliases and inherited note corroboration; exact-identity-v1.","retrievedAt":"2026-10-24T03:26:00.347307+00:00","source":"https://api.fragella.com/api/v1/fragrances/dior-grand-bal-dior-for-women","status":"provider"},"seasons":{"note":null,"retrievedAt":null,"source":"https://www.fragrantica.com/p/14984","status":"inherited"},"sillage":{"note":"Fragella provider assessment; may include model estimates. Individual observed/predicted provenance is unavailable. Provider confidence: medium. Identity matched by exact name, reviewed brand aliases and inherited note corroboration; exact-identity-v1.","retrievedAt":"2026-10-24T03:26:00.347307+00:00","source":"https://api.fragella.com/api/v1/fragrances/dior-grand-bal-dior-for-women","status":"provider"}},"fragranticaId":"14984","fragranticaUrl":"https://www.fragrantica.com/p/14984","gender":"feminine","id":"shobi-620","image":"assets/perfumes/14984.avif","imageEvidence":{"note":"Imported local bottle asset","retrievedAt":null,"source":"https://www.fragrantica.com/p/14984","status":"inherited"},"listings":[{"addedDate":null,"aliases":[],"bestSellerRank":1893,"code":"527-DRC","id":"620","originalId":"shobi-620","status":"active","url":"https://leparfum.com.gr/en/fragrances-for-women/527-drc-w"}],"longevity":{"label":"Moderate","scale":"Fragella descriptive assessment","votes":null},"mainNotes":[{"icon":"assets/note-icons/jasmine-14.webp","name":"Jasmine"},{"icon":"assets/note-icons/ylang-ylang-24.webp","name":"Ylang-Ylang"},{"icon":"assets/note-icons/orange-blossom-16.webp","name":"Orange Blossom"},{"icon":"assets/note-icons/musk-4.webp","name":"Musk"},{"icon":"assets/note-icons/sandalwood-33.webp","name":"Sandalwood"},{"icon":"assets/note-icons/bergamot-75.webp","name":"Bergamot"}],"name":"Dior Grand Bal","nameAliases":["Dior Grand Bal for women","Grand Bal"],"pyramid":{"base":["cashmeran","cedar","musk","sandalwood","woodsy notes"],"heart":["broom","jasmine","orange blossom","peach","ylang ylang"],"top":["african orange flower","bergamot","lemon tree","mandarin orange","musk"]},"rating":{"scale":"0–5 (Fragella Bayesian)","value":4.25,"votes":null},"schemaVersion":1,"seasons":["spring"],"sillage":{"label":"Strong","scale":"Fragella descriptive assessment","votes":null},"validationChecks":{"fid":true,"gender":true,"icons":true,"identity":true,"image":true,"notes":true,"season":true,"shobiIdentity":true,"shobiProduct":true,"socialCard":true,"url":true},"validationIssues":[],"validationStatus":"green"}
