{"accords":["iris","aromatic","earthy","woody","fresh spicy","powdery","violet","rose","herbal"],"brand":"Jo Malone London","description":"Iris & Lady Moore by Jo Malone London is a Floral Woody Musk fragrance for women.","edition":null,"evidence":{"accords":{"note":"Exact mapped original; independently hydrated field","retrievedAt":"2026-10-24T02:10:06.697115+00:00","source":"https://www.fragrantica.com/perfume/Jo-Malone-London/Iris-Lady-Moore-14136.html","status":"verified"},"description":{"note":"Exact mapped original; independently hydrated field","retrievedAt":"2026-10-24T02:10:06.697115+00:00","source":"https://www.fragrantica.com/perfume/Jo-Malone-London/Iris-Lady-Moore-14136.html","status":"verified"},"gender":{"note":null,"retrievedAt":null,"source":"https://www.fragrantica.com/perfume/Jo-Malone-London/Iris-Lady-Moore-14136.html","status":"inherited"},"identity":{"note":null,"retrievedAt":null,"source":"https://www.fragrantica.com/perfume/Jo-Malone-London/Iris-Lady-Moore-14136.html","status":"inherited"},"longevity":{"note":"Fragella provider assessment; may include model estimates. Individual observed/predicted provenance is unavailable. Provider confidence: low. Identity matched by exact name, reviewed brand aliases and inherited note corroboration; exact-identity-v1.","retrievedAt":"2026-10-24T03:32:04.987275+00:00","source":"https://api.fragella.com/api/v1/fragrances/iris-lady-moore-jo-malone-london-for-women","status":"provider"},"mainNotes":{"note":"Exact ordered Social Card evidence imported from MarvvRed","retrievedAt":null,"source":"https://www.fragrantica.com/perfume/Jo-Malone-London/Iris-Lady-Moore-14136.html","status":"inherited"},"pyramid":{"note":"Fragella provider assessment; may include model estimates. Individual observed/predicted provenance is unavailable. Provider confidence: low. Identity matched by exact name, reviewed brand aliases and inherited note corroboration; exact-identity-v1.","retrievedAt":"2026-10-24T03:32:04.987275+00:00","source":"https://api.fragella.com/api/v1/fragrances/iris-lady-moore-jo-malone-london-for-women","status":"provider"},"rating":{"note":"Exact mapped original; independently hydrated field","retrievedAt":"2026-10-24T02:10:06.697115+00:00","source":"https://www.fragrantica.com/perfume/Jo-Malone-London/Iris-Lady-Moore-14136.html","status":"verified"},"seasons":{"note":null,"retrievedAt":null,"source":"https://www.fragrantica.com/perfume/Jo-Malone-London/Iris-Lady-Moore-14136.html","status":"inherited"},"sillage":{"note":"Fragella provider assessment; may include model estimates. Individual observed/predicted provenance is unavailable. Provider confidence: low. Identity matched by exact name, reviewed brand aliases and inherited note corroboration; exact-identity-v1.","retrievedAt":"2026-10-24T03:32:04.987275+00:00","source":"https://api.fragella.com/api/v1/fragrances/iris-lady-moore-jo-malone-london-for-women","status":"provider"}},"fragranticaId":"14136","fragranticaUrl":"https://www.fragrantica.com/perfume/Jo-Malone-London/Iris-Lady-Moore-14136.html","gender":"feminine","id":"shobi-1168","image":"assets/perfumes/14136.avif","imageEvidence":{"note":"Imported local bottle asset","retrievedAt":null,"source":"https://www.fragrantica.com/perfume/Jo-Malone-London/Iris-Lady-Moore-14136.html","status":"inherited"},"listings":[{"addedDate":null,"aliases":[],"bestSellerRank":1886,"code":"262-JOM","id":"1168","originalId":"shobi-1168","status":"active","url":"https://leparfum.com.gr/en/elegants-fragrances/262-jom-el"}],"longevity":{"label":"Moderate","scale":"Fragella descriptive assessment","votes":null},"mainNotes":[{"icon":"assets/note-icons/iris-11.webp","name":"Iris"},{"icon":"assets/note-icons/vetiver-2.webp","name":"Vetiver"},{"icon":"assets/note-icons/geranium-21.webp","name":"Geranium"}],"name":"Iris Lady Moore","nameAliases":["Iris & Lady Moore for women"],"pyramid":{"base":["cedar","geranium","patchouli","sandalwood","vetiver"],"heart":["coriander","cypress","iris","rose","wild strawberry"],"top":["cardamom","carrot","cassis","heliotrope","vetiver"]},"rating":{"scale":"0–5","value":3.93,"votes":95},"schemaVersion":1,"seasons":["spring"],"sillage":{"label":"Strong","scale":"Fragella descriptive assessment","votes":null},"validationChecks":{"fid":true,"gender":true,"icons":true,"identity":true,"image":true,"notes":true,"season":true,"shobiIdentity":true,"shobiProduct":true,"socialCard":true,"url":true},"validationIssues":[],"validationStatus":"green"}
