{"accords":["citrus","fresh spicy","aromatic","woody","fresh"],"brand":"Dior","description":"A woody aromatic fragrance for men. Introduced in 2008.","edition":null,"evidence":{"accords":{"note":"Observed in a publicly accessible indexed original profile; exact source ID and perfume/house heading matched. public-page-extract-v1. Main Notes remain separate.","retrievedAt":"2026-10-24T03:58:48.855Z","source":"https://www.fragrantica.com/perfume/Dior/Dior-Homme-Sport-4033.html","status":"verified"},"description":{"note":"Observed in a publicly accessible indexed original profile; exact source ID and perfume/house heading matched. public-page-extract-v2. Main Notes remain separate.","retrievedAt":"2026-10-24T04:32:39.969Z","source":"https://www.fragrantica.com/perfume/Dior/Dior-Homme-Sport-4033.html","status":"verified"},"gender":{"note":null,"retrievedAt":null,"source":"https://www.fragrantica.com/perfume/Dior/Dior-Homme-Sport-4033.html","status":"inherited"},"identity":{"note":null,"retrievedAt":null,"source":"https://www.fragrantica.com/perfume/Dior/Dior-Homme-Sport-4033.html","status":"inherited"},"longevity":{"note":"Awaiting project-owned profile hydration","retrievedAt":null,"source":null,"status":"missing"},"mainNotes":{"note":"Exact ordered Social Card evidence imported from MarvvRed","retrievedAt":null,"source":"https://www.fragrantica.com/perfume/Dior/Dior-Homme-Sport-4033.html","status":"inherited"},"pyramid":{"note":"Observed in a publicly accessible indexed original profile; exact source ID and perfume/house heading matched. public-page-extract-v2. Main Notes remain separate.","retrievedAt":"2026-10-24T04:32:39.969Z","source":"https://www.fragrantica.com/perfume/Dior/Dior-Homme-Sport-4033.html","status":"verified"},"rating":{"note":"Observed in a publicly accessible indexed original profile; exact source ID and perfume/house heading matched. public-page-extract-v1. Main Notes remain separate.","retrievedAt":"2026-10-24T03:58:48.855Z","source":"https://www.fragrantica.com/perfume/Dior/Dior-Homme-Sport-4033.html","status":"verified"},"seasons":{"note":null,"retrievedAt":null,"source":"https://www.fragrantica.com/perfume/Dior/Dior-Homme-Sport-4033.html","status":"inherited"},"sillage":{"note":"Awaiting project-owned profile hydration","retrievedAt":null,"source":null,"status":"missing"}},"fragranticaId":"4033","fragranticaUrl":"https://www.fragrantica.com/perfume/Dior/Dior-Homme-Sport-4033.html","gender":"masculine","id":"shobi-178","image":"assets/perfumes/4033.avif","imageEvidence":{"note":"Imported local bottle asset","retrievedAt":null,"source":"https://www.fragrantica.com/perfume/Dior/Dior-Homme-Sport-4033.html","status":"inherited"},"listings":[{"addedDate":null,"aliases":[],"bestSellerRank":748,"code":"1082-DRC","id":"178","originalId":"shobi-178","status":"active","url":"https://leparfum.com.gr/en/fragrances-for-men/1082-drc-m#/1-choose-eau_de_parfum/2-bottle-30ml/3-extra_essence-0ml"}],"longevity":null,"mainNotes":[{"icon":"assets/note-icons/lemon-77.webp","name":"Lemon"},{"icon":"assets/note-icons/grapefruit-76.webp","name":"Grapefruit"},{"icon":"assets/note-icons/bergamot-75.webp","name":"Bergamot"},{"icon":"assets/note-icons/rosemary-49.webp","name":"Rosemary"},{"icon":"assets/note-icons/ginger-62.webp","name":"Ginger"},{"icon":"assets/note-icons/lavender-1.webp","name":"Lavender"}],"name":"HOMME SPORT","nameAliases":["Dior Homme Sport"],"pyramid":{"base":["Lavender","Rosemary","Sandalwood"],"heart":["Ginger","Vetiver","Virginia Cedar"],"top":["Amalfi Lemon","Grapefruit","Bergamot","Elemi resin"]},"rating":{"scale":"0–5","value":4.21,"votes":3386},"schemaVersion":1,"seasons":["summer"],"sillage":null,"validationChecks":{"fid":true,"gender":true,"icons":true,"identity":true,"image":true,"notes":true,"season":true,"shobiIdentity":true,"shobiProduct":true,"socialCard":true,"url":true},"validationIssues":[],"validationStatus":"green"}
