{"accords":["woody","leather","warm spicy","animalic","smoky"],"brand":"Nasomatto","description":null,"edition":null,"evidence":{"accords":{"note":"Observed in a publicly accessible indexed original profile; exact source ID and perfume/house heading matched. public-page-extract-v1. Main Notes remain separate.","retrievedAt":"2026-10-24T03:58:31.859Z","source":"https://www.fragrantica.com/perfume/Nasomatto/Duro-4291.html","status":"verified"},"description":{"note":"Awaiting project-owned profile hydration","retrievedAt":null,"source":null,"status":"missing"},"gender":{"note":null,"retrievedAt":null,"source":"https://www.fragrantica.com/perfume/Nasomatto/Duro-4291.html","status":"inherited"},"identity":{"note":null,"retrievedAt":null,"source":"https://www.fragrantica.com/perfume/Nasomatto/Duro-4291.html","status":"inherited"},"longevity":{"note":"Awaiting project-owned profile hydration","retrievedAt":null,"source":null,"status":"missing"},"mainNotes":{"note":"Exact ordered Social Card evidence imported from MarvvRed","retrievedAt":null,"source":"https://www.fragrantica.com/perfume/Nasomatto/Duro-4291.html","status":"inherited"},"pyramid":{"note":"Awaiting project-owned profile hydration","retrievedAt":null,"source":null,"status":"missing"},"rating":{"note":"Observed in a publicly accessible indexed original profile; exact source ID and perfume/house heading matched. public-page-extract-v1. Main Notes remain separate.","retrievedAt":"2026-10-24T03:58:31.859Z","source":"https://www.fragrantica.com/perfume/Nasomatto/Duro-4291.html","status":"verified"},"seasons":{"note":null,"retrievedAt":null,"source":"https://www.fragrantica.com/perfume/Nasomatto/Duro-4291.html","status":"inherited"},"sillage":{"note":"Awaiting project-owned profile hydration","retrievedAt":null,"source":null,"status":"missing"}},"fragranticaId":"4291","fragranticaUrl":"https://www.fragrantica.com/perfume/Nasomatto/Duro-4291.html","gender":"masculine","id":"shobi-2326","image":"assets/perfumes/4291.avif","imageEvidence":{"note":"Imported local bottle asset","retrievedAt":null,"source":"https://www.fragrantica.com/perfume/Nasomatto/Duro-4291.html","status":"inherited"},"listings":[{"addedDate":null,"aliases":[],"bestSellerRank":1138,"code":"323-NAS","id":"2326","originalId":"shobi-2326","status":"active","url":"https://leparfum.com.gr/en/niche-perfumes/323-nas-n#/1-choose-eau_de_parfum/2-bottle-30ml/3-extra_essence-0ml"}],"longevity":null,"mainNotes":[{"icon":"assets/note-icons/woody-notes-315.webp","name":"Woody Notes"},{"icon":"assets/note-icons/leather-156.webp","name":"Leather"},{"icon":"assets/note-icons/spicy-notes-321.webp","name":"Spicy Notes"}],"name":"Duro","nameAliases":[],"pyramid":{"base":[],"heart":[],"top":[]},"rating":{"scale":"0–5","value":4.18,"votes":3204},"schemaVersion":1,"seasons":["autumn"],"sillage":null,"validationChecks":{"fid":true,"gender":true,"icons":true,"identity":true,"image":true,"notes":true,"season":true,"shobiIdentity":true,"shobiProduct":true,"socialCard":true,"url":true},"validationIssues":[],"validationStatus":"green"}
