{"accords":["citrus","aromatic","amber","rose","vanilla","warm spicy","powdery","balsamic","white floral","sweet"],"brand":"Widian","description":null,"edition":null,"evidence":{"accords":{"note":"Fragella provider assessment; may include model estimates. Individual observed/predicted provenance is unavailable. Provider confidence: medium. Identity matched by exact name, reviewed brand aliases and inherited note corroboration; exact-identity-v1.","retrievedAt":"2026-10-24T03:17:30.795305+00:00","source":"https://api.fragella.com/api/v1/fragrances/Widian-Gold-Ii-Sahara","status":"provider"},"description":{"note":"Awaiting project-owned profile hydration","retrievedAt":null,"source":null,"status":"missing"},"gender":{"note":null,"retrievedAt":null,"source":"https://www.fragrantica.com/perfume/WIDIAN/Gold-II-Sahara-54883.html","status":"inherited"},"identity":{"note":null,"retrievedAt":null,"source":"https://www.fragrantica.com/perfume/WIDIAN/Gold-II-Sahara-54883.html","status":"inherited"},"longevity":{"note":"Fragella provider assessment; may include model estimates. Individual observed/predicted provenance is unavailable. Provider confidence: medium. Identity matched by exact name, reviewed brand aliases and inherited note corroboration; exact-identity-v1.","retrievedAt":"2026-10-24T03:17:30.795305+00:00","source":"https://api.fragella.com/api/v1/fragrances/Widian-Gold-Ii-Sahara","status":"provider"},"mainNotes":{"note":"Exact ordered Social Card evidence imported from MarvvRed","retrievedAt":null,"source":"https://www.fragrantica.com/perfume/WIDIAN/Gold-II-Sahara-54883.html","status":"inherited"},"pyramid":{"note":"Fragella provider assessment; may include model estimates. Individual observed/predicted provenance is unavailable. Provider confidence: medium. Identity matched by exact name, reviewed brand aliases and inherited note corroboration; exact-identity-v1.","retrievedAt":"2026-10-24T03:17:30.795305+00:00","source":"https://api.fragella.com/api/v1/fragrances/Widian-Gold-Ii-Sahara","status":"provider"},"rating":{"note":"Fragella provider assessment; may include model estimates. Individual observed/predicted provenance is unavailable. Provider confidence: medium. Identity matched by exact name, reviewed brand aliases and inherited note corroboration; exact-identity-v1.","retrievedAt":"2026-10-24T03:17:30.795305+00:00","source":"https://api.fragella.com/api/v1/fragrances/Widian-Gold-Ii-Sahara","status":"provider"},"seasons":{"note":null,"retrievedAt":null,"source":"https://www.fragrantica.com/perfume/WIDIAN/Gold-II-Sahara-54883.html","status":"inherited"},"sillage":{"note":"Fragella provider assessment; may include model estimates. Individual observed/predicted provenance is unavailable. Provider confidence: medium. Identity matched by exact name, reviewed brand aliases and inherited note corroboration; exact-identity-v1.","retrievedAt":"2026-10-24T03:17:30.795305+00:00","source":"https://api.fragella.com/api/v1/fragrances/Widian-Gold-Ii-Sahara","status":"provider"}},"fragranticaId":"54883","fragranticaUrl":"https://www.fragrantica.com/perfume/WIDIAN/Gold-II-Sahara-54883.html","gender":"unisex","id":"shobi-3366","image":"assets/perfumes/54883.avif","imageEvidence":{"note":"Imported local bottle asset","retrievedAt":null,"source":"https://www.fragrantica.com/perfume/WIDIAN/Gold-II-Sahara-54883.html","status":"inherited"},"listings":[{"addedDate":null,"aliases":[],"bestSellerRank":1491,"code":"1985-WID","id":"3366","originalId":"shobi-3366","status":"active","url":"https://leparfum.com.gr/en/arabian-perfumes/gold-ii-sahara-widian-similar-fragrance"}],"longevity":{"label":"Long Lasting","scale":"Fragella descriptive assessment","votes":null},"mainNotes":[{"icon":"assets/note-icons/elemi-390.webp","name":"Elemi"},{"icon":"assets/note-icons/saffron-55.webp","name":"Saffron"},{"icon":"assets/note-icons/amber-54.webp","name":"Amber"},{"icon":"assets/note-icons/rose-105.webp","name":"Rose"},{"icon":"assets/note-icons/vanilla-74.webp","name":"Vanilla"},{"icon":"assets/note-icons/orange-blossom-16.webp","name":"Orange Blossom"}],"name":"GOLD II SAHARA - WIDIAN","nameAliases":["Gold II Sahara","Widian Gold Ii Sahara"],"pyramid":{"base":["Amber","Vanilla","Musk","Cedar"],"heart":["Rose","Orange Blossom"],"top":["elemi","Saffron","Orange"]},"rating":{"scale":"0–5 (Fragella Bayesian)","value":4.22,"votes":null},"schemaVersion":1,"seasons":["autumn"],"sillage":{"label":"Strong","scale":"Fragella descriptive assessment","votes":null},"validationChecks":{"fid":true,"gender":true,"icons":true,"identity":true,"image":true,"notes":true,"season":true,"shobiIdentity":true,"shobiProduct":true,"socialCard":true,"url":true},"validationIssues":[],"validationStatus":"green"}
